{
  "schema_version": 1,
  "id": "iphone-air__hard__rear",
  "device_id": "iphone-air",
  "case_type": "hard",
  "view": "rear",
  "status": "prototype",
  "provenance": {
    "verified_device_dimensions": "156.2 x 74.7 x 5.64 mm (Apple official spec — apple.com/iphone-air/specs/)",
    "estimated_device_anchors": "single camera layout, corner radius, button positions (visually estimated from Apple product imagery)",
    "assumed_case_parameters": "1.2mm case thickness, 1.2mm print bezel (slim prototype case assumptions for Air)",
    "supplier_geometry": "none — not a production SKU template"
  },
  "canvas": {
    "width": 1650,
    "height": 2150
  },
  "print_region": {
    "mode": "mask",
    "x": 340,
    "y": 60,
    "width": 970,
    "height": 2030,
    "fit": "cover",
    "mask": "print_mask.png"
  },
  "layers": [
    {
      "type": "shadow",
      "file": "shadow.png"
    },
    {
      "type": "base",
      "file": "base.png"
    },
    {
      "type": "artwork",
      "blend": "normal"
    },
    {
      "type": "highlight",
      "file": "highlight.png",
      "opacity": 1.0
    },
    {
      "type": "overlay",
      "file": "overlay.png"
    }
  ]
}
